{
  "$id": "",
  "$schema": "http://json-schema.org/draft-07/schema#",
  "title": "web-types",
  "type": "object",
  "properties": {
    "framework": {
      "type": "string",
      "enum": [
        "vue"
      ]
    },
    "name": {
      "type": "string"
    },
    "version": {
      "type": "string"
    },
    "contributions": {
      "type": "object",
      "properties": {
        "html": {
          "$ref": "#/definitions/html"
        }
      }
    }
  },
  "required": [
    "framework",
    "name",
    "version",
    "contributions"
  ],
  "definitions": {
    "named-entity": {
      "type": "object",
      "properties": {
        "name": {
          "type": "string"
        },
        "description": {
          "type": "string"
        },
        "doc-url": {
          "type": "string"
        }
      },
      "required": [
        "name"
      ]
    },
    "typed-entity": {
      "type": "object",
      "allOf": [
        {
          "$ref": "#/definitions/named-entity"
        }
      ],
      "properties": {
        "type": {
          "anyOf": [
            {
              "type": "string"
            },
            {
              "type": "array",
              "items": {
                "type": "string"
              }
            }
          ]
        }
      }
    },
    "html": {
      "type": "object",
      "properties": {
        "types-syntax": {
          "type": "string",
          "enum": [
            "typescript"
          ]
        },
        "tags": {
          "type": "array",
          "items": {
            "$ref": "#/definitions/html-tag"
          }
        },
        "attributes": {
          "type": "array",
          "items": {
            "$ref": "#/definitions/html-attribute"
          }
        }
      }
    },
    "html-tag": {
      "type": "object",
      "allOf": [
        {
          "$ref": "#/definitions/named-entity"
        }
      ],
      "properties": {
        "source-file": {
          "type": "string"
        },
        "attributes": {
          "type": "array",
          "items": {
            "$ref": "#/definitions/html-tag-attribute"
          }
        },
        "events": {
          "type": "array",
          "items": {
            "$ref": "#/definitions/html-tag-event"
          }
        },
        "slots": {
          "type": "array",
          "items": {
            "$ref": "#/definitions/named-entity"
          }
        },
        "vue-scoped-slots": {
          "type": "array",
          "items": {
            "$ref": "#/definitions/html-tag-vue-scoped-slot"
          }
        },
        "vue-model": {
          "$ref": "#/definitions/html-tag-vue-model"
        }
      }
    },
    "html-attribute": {
      "type": "object",
      "allOf": [
        {
          "$ref": "#/definitions/typed-entity"
        }
      ],
      "properties": {
        "source-file": {
          "type": "string"
        }
      }
    },
    "html-tag-attribute": {
      "type": "object",
      "allOf": [
        {
          "$ref": "#/definitions/typed-entity"
        }
      ],
      "properties": {
        "default": {
          "type": "string"
        },
        "required": {
          "type": "boolean"
        }
      }
    },
    "html-tag-event": {
      "type": "object",
      "allOf": [
        {
          "$ref": "#/definitions/named-entity"
        }
      ],
      "properties": {
        "arguments": {
          "type": "array",
          "items": {
            "$ref": "#/definitions/typed-entity"
          }
        }
      }
    },
    "html-tag-vue-scoped-slot": {
      "type": "object",
      "allOf": [
        {
          "$ref": "#/definitions/named-entity"
        }
      ],
      "properties": {
        "properties": {
          "type": "array",
          "items": {
            "$ref": "#/definitions/typed-entity"
          }
        }
      }
    },
    "html-tag-vue-model": {
      "type": "object",
      "properties": {
        "prop": {
          "type": "string"
        },
        "event": {
          "type": "string"
        }
      }
    }
  }
}
